{
  "schema_version": 1,
  "id": "beast-cave",
  "name": "Beast Cave",
  "classification": {
    "type": "athlete-room",
    "status": "candidate",
    "public": false
  },
  "implementation": {
    "kind": "native-room",
    "module": "web/src/beast-cave.js"
  },
  "story": {
    "concept": "A room for the work nobody sees.",
    "editorial_status": "original-copy",
    "pitch": "pitch/lionel-sanders/pitch-story-v1.json"
  },
  "spatial": {
    "units": "meters",
    "coordinate_system": "host world coordinates; y vertical",
    "bounds_source": "web/src/beast-cave.js#BROOM",
    "doorway_source": "web/src/beast-cave.js#BDOOR",
    "walkability_source": "web/src/beast-cave.js#beastCaveWalkable"
  },
  "assets": {
    "manifest": "world/konam/candidates/beast-cave-asset-manifest-v1.json",
    "bike_pipeline": "museum/bike.schema.json"
  },
  "subjects": [
    {
      "subject_id": "lionel-sanders",
      "display_name": "Lionel Sanders",
      "subject_type": "athlete",
      "room_role": "room-subject",
      "claim_status": "partially-verified",
      "likeness_status": "not-used",
      "image_rights_status": "not-used",
      "brand_association_status": "unverified",
      "public_release_status": "rights-review",
      "equipment_claims": []
    }
  ],
  "interactions": {
    "authority": "KONA.m host pickables/cards/dialogs",
    "room_specific": [
      "training-screen",
      "story-art",
      "gap-sculpture",
      "recovery-zone"
    ]
  },
  "performance": {
    "mobile": {
      "target_fps": 30,
      "max_room_draw_calls": 110,
      "max_room_triangles": 220000,
      "max_texture_edge": 1024,
      "max_dpr": 1.5,
      "particle_density": 34,
      "transmission": "reduced",
      "shadow_policy": "host-budget",
      "lod_policy": "LOD1/micro-props-optional"
    },
    "tablet": {
      "target_fps": 45,
      "max_room_draw_calls": 149,
      "max_room_triangles": 341000,
      "max_texture_edge": 2048,
      "max_dpr": 1.75,
      "particle_density": 54,
      "transmission": "medium",
      "shadow_policy": "host-budget",
      "lod_policy": "LOD0/LOD1"
    },
    "desktop": {
      "target_fps": 60,
      "max_room_draw_calls": 190,
      "max_room_triangles": 450000,
      "max_texture_edge": 2048,
      "max_dpr": 2,
      "particle_density": 78,
      "transmission": "full",
      "shadow_policy": "host-budget",
      "lod_policy": "LOD0"
    }
  },
  "provenance": {
    "concept": "independent KONA.m editorial concept",
    "generated_imagery": "reference-only-not-runtime-evidence"
  },
  "rights": {
    "endorsement": false,
    "partnership": false,
    "equipment_claims_require_sources": true,
    "brand_marks_require_review": true
  },
  "release": {
    "evidence_path": "evidence/rooms/beast-cave/",
    "required_gates": [
      "schema",
      "architecture",
      "assets",
      "desktop-visual",
      "mobile-portrait",
      "mobile-landscape",
      "interaction",
      "performance",
      "truth",
      "rights"
    ],
    "public_wiring": false
  }
}
